{
  "name": "testing-tools",
  "version": "0.1.0",
  "description": "Testing automation tools for Vitest integration, Playwright E2E, coverage analysis, and monorepo testing strategies",
  "author": {
    "name": "Jace Babin",
    "email": "jbabin91@gmail.com",
    "url": "https://github.com/jbabin91"
  },
  "license": "MIT",
  "keywords": ["testing", "vitest", "playwright", "coverage", "e2e", "monorepo"]
}
