{
  "name": "typescript",
  "version": "0.1.0",
  "description": "TypeScript type checking, refactoring, import management, and type contracts",
  "author": {
    "name": "Jace Babin",
    "email": "jbabin91@gmail.com",
    "url": "https://github.com/jbabin91"
  },
  "license": "MIT",
  "keywords": ["typescript", "types", "refactoring", "imports"]
}
