{
  "$schema": "https://raw.githubusercontent.com/jbabin91/super-claude/main/.claude-plugin/plugin.schema.json",
  "name": "devops-tools",
  "version": "0.1.0",
  "description": "DevOps automation including Docker Compose helpers, environment variable management, and GitHub Actions workflow generation",
  "author": {
    "name": "Jace Babin",
    "email": "jbabin91@gmail.com",
    "url": "https://github.com/jbabin91"
  },
  "license": "MIT",
  "keywords": [
    "devops",
    "docker",
    "ci-cd",
    "github-actions",
    "environment",
    "automation"
  ]
}
