{
  "name": "design-system",
  "version": "0.1.0",
  "description": "Component libraries with Base UI, shadcn/ui, design tokens, WCAG AAA accessibility, and Storybook integration",
  "author": {
    "name": "Jace Babin",
    "email": "jbabin91@gmail.com",
    "url": "https://github.com/jbabin91"
  },
  "homepage": "https://github.com/jbabin91/super-claude/tree/main/plugins/design-system",
  "repository": "https://github.com/jbabin91/super-claude",
  "license": "MIT",
  "keywords": [
    "base-ui",
    "shadcn",
    "design-system",
    "accessibility",
    "storybook",
    "components"
  ]
}
