{
  "name": "meta",
  "version": "0.4.0",
  "description": "Meta-tools for creating and managing Claude Code components. Generate skills, commands, agents, hooks, and plugins with proper structure and validation.",
  "author": {
    "name": "Jace Babin",
    "email": "jbabin91@gmail.com",
    "url": "https://github.com/jbabin91"
  },
  "homepage": "https://github.com/jbabin91/super-claude/tree/main/plugins/meta",
  "repository": "https://github.com/jbabin91/super-claude",
  "license": "MIT",
  "keywords": [
    "skills",
    "meta",
    "generator",
    "validation",
    "claude-code",
    "commands",
    "agents",
    "hooks",
    "plugins"
  ]
}
