{
  "name": "git",
  "version": "0.1.0",
  "description": "Git workflow automation: smart commits with gitmoji, PR descriptions, changelogs, worktrees",
  "author": {
    "name": "Jace Babin",
    "email": "jbabin91@gmail.com",
    "url": "https://github.com/jbabin91"
  },
  "license": "MIT",
  "keywords": ["git", "commits", "pr", "changelog", "worktrees"]
}
