{
  "$schema": "https://raw.githubusercontent.com/jbabin91/super-claude/main/.claude-plugin/plugin.schema.json",
  "name": "skill-tools",
  "version": "0.1.0",
  "description": "Meta-tools for creating, validating, and managing Claude Code skills. Build custom skills for your specific workflows and projects.",
  "author": {
    "name": "Jace Babin",
    "email": "jbabin91@gmail.com",
    "url": "https://github.com/jbabin91"
  },
  "license": "MIT",
  "keywords": [
    "skills",
    "meta",
    "generator",
    "validation",
    "claude-code",
    "automation"
  ]
}
