{
  "name": "workflow",
  "version": "0.4.2",
  "description": "Development workflow enhancements including OpenSpec proposal management, skill auto-activation, and command hooks for session checklists, type checking, commit guards, and branch name validation.",
  "author": {
    "name": "Jace Babin",
    "email": "jbabin91@gmail.com",
    "url": "https://github.com/jbabin91"
  },
  "license": "MIT",
  "keywords": [
    "workflow",
    "openspec",
    "automation",
    "auto-activation",
    "hooks",
    "development",
    "claude-code",
    "type-checking",
    "commit-guard"
  ]
}
