{
  "name": "devops",
  "version": "0.1.0",
  "description": "GitHub Actions, Docker, CI/CD pipelines, and deployment automation",
  "author": {
    "name": "Jace Babin",
    "email": "jbabin91@gmail.com",
    "url": "https://github.com/jbabin91"
  },
  "homepage": "https://github.com/jbabin91/super-claude/tree/main/plugins/devops",
  "repository": "https://github.com/jbabin91/super-claude",
  "license": "MIT",
  "keywords": ["devops", "github-actions", "docker", "ci-cd"]
}
